{
  "$schema": "./schema.json",
  "year": 2022,
  "season": "Summer",
  "duration": "2022년 1학기 ~ 2022년 8월",
  "president": [
    {
      "name": "김은서",
      "school": "이화여자대학교",
      "role": "회장"
    },
    {
      "name": "전지수",
      "school": "홍익대학교",
      "role": "회장"
    }
  ],
  "manager": [
    {
      "name": "이가은",
      "school": "숙명여자대학교",
      "role": "운영진"
    },
    {
      "name": "김가영",
      "school": "숙명여자대학교",
      "role": "운영진"
    },
    {
      "name": "박예나",
      "school": "숙명여자대학교",
      "role": "운영진"
    },
    {
      "name": "함윤주",
      "school": "홍익대학교",
      "role": "운영진"
    },
    {
      "name": "이원주",
      "school": "이화여자대학교",
      "role": "운영진"
    },
    {
      "name": "이재혁",
      "school": "서강대학교",
      "role": "운영진"
    },
    {
      "name": "유영서",
      "school": "연세대학교",
      "role": "운영진"
    }
  ],
  "campContributor": [
    {
      "level": "초급",
      "lecturer": [
        {
          "name": "김재헌",
          "school": "홍익대학교",
          "bojHandle": "xhdtlsid2"
        },
        {
          "name": "곽재혁",
          "school": "연세대학교",
          "bojHandle": "dreami63"
        }
      ],
      "mentor": [
        {
          "name": "김동건",
          "school": "서강대학교",
          "bojHandle": "dong_gas"
        },
        {
          "name": "이선주",
          "school": "홍익대학교",
          "bojHandle": "sunjoo9912"
        },
        {
          "name": "이지은",
          "school": "홍익대학교",
          "bojHandle": "leeju1013"
        },
        {
          "name": "한상필",
          "school": "서강대학교",
          "bojHandle": "tksvlf123"
        }
      ]
    },
    {
      "level": "중급",
      "lecturer": [
        {
          "name": "구재원",
          "school": "한양대학교",
          "bojHandle": "jjaewon9"
        },
        {
          "name": "나정휘",
          "school": "숭실대학교",
          "bojHandle": "jhnah917"
        }
      ]
    }
  ]
}
