{
  "$schema": "./schema.json",
  "year": 2024,
  "season": "Winter",
  "duration": "2023년 2학기 ~ 2024년 2월",
  "president": [
    {
      "name": "정은채",
      "school": "이화여자대학교",
      "role": "회장"
    },
    {
      "name": "조다니엘",
      "school": "서강대학교",
      "role": "회장"
    }
  ],
  "manager": [
    {
      "name": "김예송",
      "school": "홍익대학교",
      "role": "총무"
    },
    {
      "name": "김정은",
      "school": "숙명여자대학교",
      "role": "홍보팀장"
    },
    {
      "name": "김정민",
      "school": "이화여자대학교",
      "role": "홍보팀 운영진"
    },
    {
      "name": "박준영",
      "school": "서강대학교",
      "role": "홍보팀 운영진"
    },
    {
      "name": "이지언",
      "school": "연세대학교",
      "role": "홍보팀 운영진"
    },
    {
      "name": "천민재",
      "school": "홍익대학교",
      "role": "학생관리팀장"
    },
    {
      "name": "박경욱",
      "school": "연세대학교",
      "role": "학생관리팀 운영진"
    },
    {
      "name": "장희주",
      "school": "숙명여자대학교",
      "role": "학생관리팀 운영진"
    },
    {
      "name": "조수아",
      "school": "이화여자대학교",
      "role": "학생관리팀 운영진"
    }
  ],
  "contributor": [
    {
      "name": "김성현",
      "school": "서강대학교",
      "role": "프로그램관리팀장"
    },
    {
      "name": "길수민",
      "school": "숙명여자대학교",
      "role": "문제선정자"
    },
    {
      "name": "이국렬",
      "school": "연세대학교",
      "role": "문제선정자"
    },
    {
      "name": "임지환",
      "school": "서강대학교",
      "role": "문제선정자"
    },
    {
      "name": "노현근",
      "school": "홍익대학교",
      "role": "디자인팀"
    }
  ],
  "campContributor": [
    {
      "level": "초급",
      "lecturer": [
        {
          "name": "박찬솔",
          "school": "숭실대학교",
          "bojHandle": "chansol"
        },
        {
          "name": "채성우",
          "school": "서강대학교",
          "bojHandle": "lem0nad3"
        },
        {
          "name": "황채원",
          "school": "이화여자대학교",
          "bojHandle": "chaerryos"
        }
      ],
      "mentor": [
        {
          "name": "이성진",
          "school": "서강대학교",
          "bojHandle": "moralbook"
        },
        {
          "name": "이지언",
          "school": "연세대학교",
          "bojHandle": "ez_code"
        },
        {
          "name": "천민재",
          "school": "홍익대학교",
          "bojHandle": "open_mind"
        }
      ]
    },
    {
      "level": "중급",
      "lecturer": [
        {
          "name": "김건우",
          "school": "연세대학교",
          "bojHandle": "coconut99"
        },
        {
          "name": "김영현",
          "school": "서울대학교",
          "bojHandle": "kipa00"
        },
        {
          "name": "김태윤",
          "school": "연세대학교",
          "bojHandle": "ystaeyoon113"
        }
      ],
      "mentor": [
        {
          "name": "길수민",
          "school": "숙명여자대학교",
          "bojHandle": "2093ab"
        },
        {
          "name": "박경욱",
          "school": "연세대학교",
          "bojHandle": "sk091204091204"
        },
        {
          "name": "이협",
          "school": "연세대학교",
          "bojHandle": "dlguq0107"
        }
      ]
    }
  ]
}
