{
  "$schema": "./schema.json",
  "year": 2026,
  "season": "Summer",
  "duration": "2026년 1학기 ~ 2026년 8월",
  "president": [
    {
      "name": "윤지호",
      "school": "연세대학교",
      "role": "캠프장"
    },
    {
      "name": "정민규",
      "school": "홍익대학교",
      "role": "캠프장"
    }
  ],
  "manager": [
    {
      "name": "김규민",
      "school": "서강대학교",
      "role": "학생관리팀"
    },
    {
      "name": "김민서",
      "school": "연세대학교",
      "role": "대회관리팀"
    },
    {
      "name": "김은채",
      "school": "이화여자대학교",
      "role": "대회관리팀"
    },
    {
      "name": "류상겸",
      "school": "연세대학교",
      "role": "총무, 학생관리팀, 대회관리팀"
    },
    {
      "name": "오소정",
      "school": "이화여자대학교",
      "role": "학생관리팀, 디자인팀"
    },
    {
      "name": "오지우",
      "school": "이화여자대학교",
      "role": "디자인팀"
    },
    {
      "name": "이지은",
      "school": "숙명여자대학교",
      "role": "학생관리팀"
    },
    {
      "name": "이하늘",
      "school": "숙명여자대학교",
      "role": "대회관리팀"
    },
    {
      "name": "장주원",
      "school": "연세대학교",
      "role": "대회관리팀"
    }
  ],
  "campContributor": []
}
