{
  "$schema": "./schema.json",
  "year": 2026,
  "season": "Winter",
  "duration": "2025년 2학기 ~ 2026년 2월",
  "president": [
    {
      "name": "이하람",
      "school": "연세대학교",
      "role": "캠프장"
    },
    {
      "name": "오유림",
      "school": "연세대학교",
      "role": "캠프장"
    }
  ],
  "manager": [
    {
      "name": "박시영",
      "school": "서강대학교",
      "role": "디자인팀, 총무팀"
    },
    {
      "name": "안지선",
      "school": "홍익대학교",
      "role": "홍보팀장"
    },
    {
      "name": "이하늘",
      "school": "숙명여자대학교",
      "role": "홍보팀"
    },
    {
      "name": "정민규",
      "school": "홍익대학교",
      "role": "디자인팀, 홍보팀"
    },
    {
      "name": "윤지호",
      "school": "연세대학교",
      "role": "홍보팀"
    },
    {
      "name": "김태윤",
      "school": "서강대학교",
      "role": "홍보팀"
    },
    {
      "name": "엄수현",
      "school": "이화여자대학교",
      "role": "학생관리팀장"
    },
    {
      "name": "이수진",
      "school": "이화여자대학교",
      "role": "디자인팀, 학생관리팀"
    },
    {
      "name": "류상겸",
      "school": "연세대학교",
      "role": "학생관리팀"
    },
    {
      "name": "노주환",
      "school": "서강대학교",
      "role": "프로그램관리팀, 학생관리팀"
    }
  ],
  "campContributor": []
}
