{
  "$schema": "./schema.json",
  "year": 2025,
  "season": "Winter",
  "duration": "2024년 2학기 ~ 2025년 2월",
  "president": [
    {
      "name": "최연재",
      "school": "숙명여자대학교",
      "role": "회장"
    },
    {
      "name": "서채연",
      "school": "홍익대학교",
      "role": "회장"
    }
  ],
  "manager": [
    {
      "name": "신정화",
      "school": "이화여자대학교",
      "role": "총무"
    },
    {
      "name": "홍서희",
      "school": "숙명여자대학교",
      "role": "홍보팀장"
    },
    {
      "name": "김지호",
      "school": "연세대학교",
      "role": "홍보팀"
    },
    {
      "name": "황채원",
      "school": "이화여자대학교",
      "role": "홍보팀"
    },
    {
      "name": "김태윤",
      "school": "서강대학교",
      "role": "홍보팀"
    },
    {
      "name": "허예진",
      "school": "홍익대학교",
      "role": "홍보팀"
    },
    {
      "name": "이재찬",
      "school": "서강대학교",
      "role": "학생관리팀장"
    },
    {
      "name": "한유리",
      "school": "이화여자대학교",
      "role": "학생관리팀"
    },
    {
      "name": "박지은",
      "school": "이화여자대학교",
      "role": "학생관리팀"
    },
    {
      "name": "이채은",
      "school": "숙명여자대학교",
      "role": "학생관리팀"
    },
    {
      "name": "강호현",
      "school": "연세대학교",
      "role": "학생관리팀"
    }
  ],
  "campContributor": []
}
